Kanji,Reading,Meaning,Japanese Example,English Example
作法,さほう,"manners, etiquette, propriety",彼女は作法がとてもよい。,She has very good manners.
様々,さまざま,"varied, various",この町には様々なレストランがある。,There are various restaurants in this town.
冷ます,さます,"to cool, to let cool",お茶を冷ますのを忘れてしまった。,I forgot to cool down the tea.
覚ます,さます,to awaken,目が覚ますと、美しい景色が広がっていた。,"When I woke up, a beautiful view spread out before me."
冷める,さめる,"to become cool, to wear off",コーヒーが冷める前に飲まないと。,I have to drink the coffee before it gets cold.
覚める,さめる,"to wake, to wake up",夢から覚めて現実に戻る。,To wake up from a dream and return to reality.
左右,さゆう,left and right; influence,その決定にはあなたの助言が大きな左右をしました。,Your advice had a significant influence on that decision.
皿,さら,"plate, dish",テーブルの上にお皿が置いてあります。,There are plates placed on the table.
更に,さらに,"furthermore, moreover",彼女は更にその話について説明しました。,She further explained the story.
去る,さる,"to leave, to go away",去る者は日々に疎し。,"Out of sight, out of mind."
猿,さる,monkey,その公園にはたくさんの猿がいる。,There are many monkeys in that park.
騒ぎ,さわぎ,"uproar, disturbance",騒ぎが収まってから話をしよう。,Let's talk after the commotion settles down.
参加,さんか,participation,彼はそのプロジェクトに参加している。,He is participating in the project.
参考,さんこう,"reference, consultation",この本は参考になる。,This book is helpful as a reference.
賛成,さんせい,"approval, agreement",私はその提案に賛成です。,I agree with the proposal.
酸性,さんせい,acidity,その液体は酸性を示している。,The liquid shows acidity.
酸素,さんそ,oxygen,人間は酸素を呼吸する。,Humans breathe oxygen.
氏,し,"family name, lineage",その氏の先祖は有名人だったらしい。,It seems that the ancestors of that family were famous.
詩,し,poem; poetry,彼女は詩を書くのが得意だ。,She is good at writing poems.
幸せ,しあわせ,"happiness, blessing",家族と一緒に過ごす時間は幸せだ。,Spending time with family is happiness.
ジーンズ,ジーンズ,jeans,彼はいつもジーンズを履いている。,He always wears jeans.
ジェット機,ジェットき,jet plane,ジェット機は速く飛ぶ。,Jet planes fly fast.
四角,しかく,square,その部屋は四角い形をしている。,The room has a square shape.
直に,じかに,"immediately, readily, directly",直にその問題を解決すべきだ。,The problem should be solved immediately.
しかも,しかも,"moreover, furthermore, besides, plus",彼は頭がいい。しかも、スポーツも得意だ。,"He is smart. Moreover, he is good at sports."
四季,しき,four seasons,日本は四季がはっきりしている。,Japan has distinct four seasons.
直,じき,"immediately, soon, shortly",その案件には直に対処する必要がある。,We need to deal with the matter directly.
時期,じき,"time, season, period",引っ越しをする良い時期を見つける。,Find a good time to move.
支給,しきゅう,"payment, allowance",給与が支給されました。,The salary was paid.
至急,しきゅう,"urgent, pressing",至急、医者の診察を受ける必要があります。,It is urgent that you see a doctor immediately.
しきりに,しきりに,"frequently, repeatedly, eagerly",彼はしきりにその話を繰り返した。,He frequently repeated the story.
刺激,しげき,"stimulus, impetus, incentive",新しいアイデアが創造性を刺激する。,New ideas stimulate creativity.
資源,しげん,resources,再生可能なエネルギー資源を活用する。,Utilize renewable energy resources.
事件,じけん,"event, affair, incident",その事件は大きな議論を巻き起こした。,The incident sparked a big debate.
時刻,じこく,"time, hour",会議の時刻を確認する。,Check the time of the meeting.
自殺,じさつ,suicide,自殺は決して解決策ではない。,Suicide is never a solution.
事実,じじつ,"fact, truth, reality",その文書には事実と異なる部分がある。,The document has parts that are different from the truth.
支出,ししゅつ,"expenditure, expenses",月々の支出を管理する必要がある。,It is necessary to manage monthly expenses.
事情,じじょう,"circumstances, situation, reasons",彼女の行動は事情を説明している。,Her actions explain the circumstances.
詩人,しじん,poet,この国の詩人たちは才能豊かだ。,The poets in this country are talented.
自身,じしん,oneself,自身の力を信じてください。,Believe in your own abilities.
沈む,しずむ,to sink; to feel depressed,彼は失敗した時、気持ちが沈んだ。,He felt depressed when he failed.
自然,しぜん,"nature, spontaneous",自然の美しさに魅了される。,I am fascinated by the beauty of nature.
思想,しそう,"thought, idea",彼女は独自の思想を持っている。,She has her own ideas.
舌,した,tongue,舌を出してください。,Please stick out your tongue.
次第,しだい,order; circumstances; immediate(ly),天候次第で、予定が変わる。,"Depending on the weather, the schedule may change."
従う,したがう,"to abide (by the rules), to obey",部屋の規則に従ってください。,Please abide by the rules of the room.
したがって,したがって,"therefore, consequently",天気予報によると、明日は雨が降るということだ。したがって、傘を持って行くべきだ。,"According to the weather forecast, it will rain tomorrow. Therefore, you should bring an umbrella."
親しい,したしい,"intimate, close (e.g., friend)",彼女は親しい友達です。,She is a close friend.
質,しつ,"quality, nature (of person)",製品の質を確認してください。,Please check the quality of the product.
失業,しつぎょう,unemployment,失業者の数が増えている。,The number of unemployed people is increasing.
湿気,しっけ,"moisture, humidity, dampness",湿気の多い日は髪の毛が広がる。,"On humid days, hair tends to frizz."
実験,じっけん,lab work; experiment,実験結果をまとめてください。,Please summarize the experimental results.
実現,じつげん,"implementation, materialization, realization",夢が実現する日が来る。,The day when dreams come true will come.
実行,じっこう,"practice, execution (e.g., program), realization",計画を実行する準備が整った。,Preparations to implement the plan are complete.
実際,じっさい,in fact; in actuality,選挙で実際の支持率がわかる。,The actual approval rating will be known in the election.
実施,じっし,"enforcement, carry out, operation",イベントの実施日が変更になりました。,The date of the event implementation has been changed.
湿度,しつど,humidity,湿度が高いと体が重く感じる。,High humidity makes the body feel heavy.
じっと,じっと,"patiently, quietly",子供たちはじっとしていられない。,Children can't sit still.
実に,じつに,"indeed, truly, surely",実に興味深い本だった。,It was a truly interesting book.
実は,じつは,actually; in fact,実は、それは私のミスです。,"Actually, that was my mistake."
失望,しつぼう,"disappointment, despair",彼女は失望のあまり泣いた。,She cried in disappointment.
実力,じつりょく,ability; force,実力を試すチャンスがやってきた。,The opportunity to test one's abilities has come.
支店,してん,branch store (office),そのフランチャイズは新しい支店をオープンした。,The franchise opened a new branch.
指導,しどう,"leadership, guidance, coaching",彼は部下に的確な指導を行った。,He provided precise guidance to his subordinates.
自動,じどう,"automatic, self-motion",この車は自動ドアがついている。,This car has automatic doors.
児童,じどう,"children, juvenile",この施設は児童向けのプログラムを提供している。,This facility offers programs for children.
品,しな,"thing, article, goods",彼の品は一級だ。,His goods are first-rate.
支配,しはい,"rule, control, direction",彼は会社を完全に支配している。,He fully controls the company.
芝居,しばい,"play, drama",その芝居には感動した。,I was moved by that play.
しばしば,しばしば,"often, again and again, frequently",彼はしばしばその店に行く。,He often goes to that store.
芝生,しばふ,lawn,公園には広い芝生が広がっている。,The park has a wide lawn.
支払,しはらい,payment,支払い方法を選んでください。,Please choose a payment method.
支払う,しはらう,to pay,商品を受け取った後で支払ってください。,Please pay after receiving the goods.
死亡,しぼう,death,事故で数名の死亡者が出た。,Several people died in the accident.
資本,しほん,"funds, capital",新会社に投資資本を提供する。,Provide investment capital to the new company.
姉妹,しまい,sisters,彼らは仲の良い姉妹です。,They are close sisters.
しまった (かん),しまった (かん),Damn it!,しまった！かんけいないんでした。,Damn it! It wasn't my fault.
自慢,じまん,"pride, boast",彼は自分の子供の成績を自慢している。,He boasts about his child's grades.
地味,じみ,"quiet, plain, conservative",彼女の服装はいつも地味だ。,Her outfits are always understated.
示す,しめす,"to show, to indicate",その数字は答えを示している。,That number is indicating the answer.
占める,しめる,to take up; to account for,市場でのシェアを占める。,To account for market share.
湿る,しめる,"to be wet, to be damp",服が雨で湿っている。,The clothes are damp from the rain.
下,しも,"under, below, beneath",テーブルの下に本を置いた。,I put the book under the table.
霜,しも,frost,朝に畑に霜が降りた。,There was frost on the field in the morning.
借金,しゃっきん,"debt, loan, liabilities",彼は借金を返済している。,He is repaying his debt.
しゃべる,しゃべる,"to talk, to chat, to chatter (same as 話す (はなす))",友達と楽しくしゃべる。,To chat with friends.
週,しゅう,week,週の最後は金曜日だ。,Friday is the end of the week.
州,しゅう,"state, province",アメリカの州は50あります。,There are 50 states in the United States.
銃,じゅう,gun,警官には銃が必要だ。,Police officers need guns.
周囲,しゅうい,"surroundings, circumference, environs",周囲に気を配る。,To pay attention to one's surroundings.
収穫,しゅうかく,"harvest, crop, ingathering",収穫祭は楽しい行事だ。,The harvest festival is a fun event.
宗教,しゅうきょう,religion,様々な宗教が存在する。,There are various religions in the world.
重視,じゅうし,"importance, stress",効率を重視する。,To place importance on efficiency.
就職,しゅうしょく,finding employment,良い就職先を見つける。,To find a good job.
ジュース,ジュース,"juice, soft drink; deuce",オレンジジュースを飲む。,Drink orange juice.
修正,しゅうせい,"amendment, correction",誤りを修正する。,To correct mistakes.
重体,じゅうたい,"seriously ill, critical state",父は重体だ。,My father is in critical condition.
渋滞,じゅうたい,"congestion (e.g., traffic), delay",朝の通勤時間は渋滞する。,There is traffic congestion during the morning commute.
重大,じゅうだい,"serious, important",重大な問題が発生した。,A serious problem occurred.
住宅,じゅうたく,"resident, housing",新しい住宅を建てる。,To build a new residence.
集団,しゅうだん,"group, mass",集団で活動する。,To work in a group.
集中,しゅうちゅう,"concentration, focusing the mind",集中力を鍛える。,To train concentration.
収入,しゅうにゅう,"income, revenue",安定した収入を得る。,To earn a stable income.
住民,じゅうみん,"inhabitants, residents",この地域の住民は親切だ。,The residents of this area are kind.
重要,じゅうよう,"important, essential",計画の成功には重要だ。,It is important for the success of the plan.
修理,しゅうり,"repairing, mending",自転車を修理する。,To repair a bicycle.
主義,しゅぎ,"doctrine, cause, principle",平和主義を信奉する。,To advocate pacifism.
宿泊,しゅくはく,lodging,ホテルで宿泊する。,To stay overnight at a hotel.
手術,しゅじゅつ,surgical operation,手術が成功した。,The surgery was successful.
首相,しゅしょう,Prime Minister,新しい首相が就任した。,A new prime minister has taken office.
手段,しゅだん,"means, way, measure",解決策を考える手段を考える。,To think of ways to find a solution.
主張,しゅちょう,"claim, insistence, assertion",自分の意見を主張する。,To assert one's opinion.
出場,しゅつじょう,participation,大会に出場する。,To participate in a competition.
出身,しゅっしん,come from,彼はロンドン出身だ。,He is from London.
出版,しゅっぱん,publication,新しい本を出版する。,To publish a new book.
首都,しゅと,capital city,東京は日本の首都だ。,Tokyo is the capital of Japan.
主婦,しゅふ,housewife,主婦業は大変だけれど、やり甲斐がある。,"Being a housewife is hard work, but rewarding."
主要,しゅよう,"chief, main",主要なポイントを抑える。,To grasp the main points.
需要,じゅよう,demand,需要と供給のバランスを取る。,To balance supply and demand.
種類,しゅるい,"variety, kind",このお店の種類は豊富だ。,The variety of this store is abundant.
順,じゅん,"order, turn",次は私の順番です。,Next is my turn.
瞬間,しゅんかん,"moment, second",彼は瞬間的な判断を下した。,He made a momentary decision.
順調,じゅんちょう,doing well,仕事は順調に進んでいます。,The work is progressing smoothly.
順番,じゅんばん,"turn (in line), order of things",待っている人たちの順番です。,It's the turn of the people waiting.
使用,しよう,"use (same as 使うこと (つかうこと)), application, employment, utilization",この製品の使用方法を知っていますか？,Do you know how to use this product?
小,しょう,small,その小さな部屋にたくさんの本がある。,There are many books in that small room.
章,しょう,"chapter, section; medal",この本の新しい章を読んでください。,Please read the new chapter of this book.
賞,しょう,"prize, award",彼はその大会で賞を受賞した。,He won an award at the competition.
上,じょう,first volume; superior quality; governmental,上質な材料を使用しています。,We are using high-quality materials.
障害,しょうがい,"obstacle, impediment",彼は障害を乗り越えて成功した。,He overcame obstacles and succeeded.
奨学金,しょうがくきん,scholarship,彼は奨学金を受けて大学に行った。,He went to university on a scholarship.
乗客,じょうきゃく,passenger,電車にはたくさんの乗客がいた。,There were many passengers on the train.
上京,じょうきょう,proceeding to the capital (Tokyo),彼は東京に上京した。,He moved to Tokyo.
状況,じょうきょう,"state of affairs, situation",その会議の状況を報告してください。,Please report on the situation of the meeting.
条件,じょうけん,"conditions, terms",契約にはいくつかの条件があります。,There are several conditions in the contract.
正午,しょうご,"noon, mid-day",バスは正午に出発します。,The bus departs at noon.
正直,しょうじき,"honesty, integrity, frankness",彼は正直な人です。,He is an honest person.
常識,じょうしき,common sense,その行動は常識的ではありません。,That behavior is not common sense.
少女,しょうじょ,young girl,公園で少女たちが遊んでいる。,The young girls are playing in the park.
少々,しょうしょう,a little; short (time) (formal for 少し (すこし)),少々お待ちください。,Please wait a moment.
症状,しょうじょう,"symptoms, condition",彼の病気の症状がひどくなった。,His illness symptoms worsened.
生じる,しょうじる,"to occur, to arise, to be generated",問題が生じた場合にはお知らせください。,Please inform us if any problems arise.
状態,じょうたい,"condition, situation",設備の状態を確認してください。,Please check the condition of the equipment.
上達,じょうたつ,"improvement, advance",勉強の成績が上達した。,His study grades have improved.
冗談,じょうだん,a joke,彼は面白い冗談を言った。,He made a funny joke.
上等,じょうとう,"first class, very good",このレストランのサービスは上等だ。,The service at this restaurant is excellent.
衝突,しょうとつ,"collision, conflict",その二つの車は衝突した。,The two cars collided.
商人,しょうにん,"trader, shopkeeper, merchant",古い町には多くの商人がいる。,There are many merchants in the old town.
承認,しょうにん,"recognition, approval",申請書に承認印を押してください。,Please stamp your approval on the application form.
少年,しょうねん,"boys, juveniles",公園で少年たちがサッカーをしている。,The boys are playing soccer in the park.
商売,しょうばい,"trade, business, commerce",父は昔から商売をしている。,My father has been in business for a long time.
消費,しょうひ,"consumption, expenditure",エネルギー消費を減らす方法を考える。,Think of ways to reduce energy consumption.
商品,しょうひん,"commodity, merchandise",この店では安全な商品のみを販売しています。,This store sells only safe products.
賞品,しょうひん,"prize, trophy",大会で賞品を獲得した。,Won a prize at the competition.
消防,しょうぼう,"fire fighting, fire department",火災の消防訓練を行う。,Conduct fire fighting drills.
情報,じょうほう,"information, (military) intelligence",その情報は機密事項です。,That information is confidential.
証明,しょうめい,"proof, verification",証明書を取得する手続きを行ってください。,Please go through the process of obtaining a certificate.
省略,しょうりゃく,"omission, abbreviation, abridgment",長い文章を省略して要点を述べる。,Summarize the main points by omitting long sentences.
女王,じょおう,queen,彼女はその国の女王です。,She is the queen of the country.
職,しょく,employment,彼は新しい職を見つけた。,He found a new job.
職業,しょくぎょう,"occupation, business",父の職業は医者です。,My father's occupation is a doctor.
食卓,しょくたく,dining table,家族で食卓を囲んで食事を楽しんだ。,The family enjoyed a meal around the dining table.
食品,しょくひん,foodstuff,スーパーで食品を買いました。,I bought foodstuff at the supermarket.
植物,しょくぶつ,"plant, vegetation",庭に美しい植物がたくさんあります。,There are many beautiful plants in the garden.
食物,しょくもつ,"food, foodstuff",バランスの取れた食物を摂取することが大切です。,It is important to consume a balanced diet.
食欲,しょくよく,appetite (for food),彼女は食欲が旺盛だ。,She has a hearty appetite.
食料,しょくりょう,food,飢えた人々に食料を提供する。,Provide food to the hungry.
食糧,しょくりょう,"provisions, rations",災害時には食糧の備蓄が大切だ。,Stockpiling provisions is important during disasters.
書斎,しょさい,"study, den",彼の書斎は本で溢れていた。,His study room was overflowing with books.
女子,じょし,"woman, girl",学校の女子寮に住んでいる。,She lives in the school's girls' dormitory.
助手,じょしゅ,"helper, assistant",彼は有能な助手を雇った。,He hired a competent assistant.
徐々に,じょじょに,"slowly, little by little",彼女は徐々に回復している。,She is gradually recovering.
署名,しょめい,signature,書類に署名する必要があります。,You need to sign the document.
書物,しょもつ,books,大学でたくさんの書物を読む。,I read many books at university.
女優,じょゆう,actress,彼女は有名な女優だ。,She is a famous actress.
処理,しょり,"processing, treatment, disposition",問題について処理を行う。,Deal with the issue.
書類,しょるい,"documents, official papers",書類を提出しなければなりません。,You must submit the documents.
知らせ,しらせ,notice,大事な知らせが入っている。,There is important news in the notice.
尻,しり,"buttocks, bottom",座っていると尻が痛い。,My buttocks hurt from sitting.
知合い,しりあい,acquaintance,彼とは昔からの知合いだ。,He is an old acquaintance.
印,しるし,mark; symbol; evidence,重要な箇所に印をつける。,Mark important sections with a symbol.
城,しろ,castle,城の壁を登った。,Climbed the walls of the castle.
進学,しんがく,going on to university,進学するために頑張っている。,Working hard to advance to university.
神経,しんけい,"nerve, sensitivity",彼は神経質な性格だ。,He has a nervous personality.
真剣,しんけん,"seriousness, earnestness",真剣に取り組むことが大切だ。,It is important to approach it seriously.
信仰,しんこう,"(religious) faith, belief",彼は信仰心が厚い。,He has strong faith.
信号,しんごう,"traffic lights, signal, semaphore",信号を守って横断歩道を渡る。,Cross the pedestrian crossing obeying the traffic lights.
人工,じんこう,"artificial, man made, human work,",この池は人工の作られたものです。,This pond is man-made.
深刻,しんこく,serious,問題は深刻な状況になっている。,The situation has become serious.
診察,しんさつ,medical examination (of a patient),医者による診察が必要だ。,Medical examination by a doctor is necessary.
人種,じんしゅ,race (of people),人種差別は許されない。,Racial discrimination is not tolerated.
信じる,しんじる,to believe,自分を信じることが大切だ。,It is important to believe in oneself.
人生,じんせい,"(human) life (e.g., conception to death)",人生は冒険だ。,Life is an adventure.
親戚,しんせき,relative(s),親戚が家を訪ねてきた。,Relatives visited the house.
新鮮,しんせん,fresh,新鮮な野菜を買う。,Buy fresh vegetables.
心臓,しんぞう,heart,運動すると心臓が速くなる。,Heart rate increases with exercise.
身体,しんたい,the body,毎日運動して、身体を健康に保つ。,Exercise daily to keep your body healthy.
身長,しんちょう,"height (of body), stature",彼は身長が高い。,He is tall in stature.
慎重,しんちょう,"careful, prudent, cautious",決断する際は慎重に行動する。,Act carefully when making decisions.
審判,しんぱん,"umpire, referee, judgment",テニスの試合には審判が必要です。,A tennis match requires an umpire.
人物,じんぶつ,"character, personality, talented man",彼は非常に才能のある人物です。,He is a very talented individual.
進歩,しんぽ,"improvement, progress, development",技術の進歩に驚いています。,I am amazed by the progress in technology.
親友,しんゆう,"close friend, buddy",彼女は私の親友です。,She is my close friend.
信用,しんよう,"confidence, dependence",ビジネスでは信用が非常に重要です。,Credibility is crucial in business.
信頼,しんらい,"reliance, trust, confidence",家族はお互いを信頼しています。,Family members trust each other.
心理,しんり,mentality,心理学の研究が興味深いです。,The study of psychology is fascinating.
人類,じんるい,"mankind, humanity",人類の歴史を学ぶ。,Studying the history of mankind.
巣,す,"nest, breeding place",鳥の巣が木の上にあります。,There is a bird's nest on the tree.
酢,す,vinegar,サラダに酢をかけます。,I put vinegar on the salad.
図,ず,"figure, drawing, illustration",地図を見て道を探す。,Looking at the map to find the way.
水準,すいじゅん,"level, standard",そのテストの水準は高いです。,The level of that test is high.
推薦,すいせん,recommendation,彼を新しいポジションに推薦しました。,I recommended him for the new position.
スイッチ,スイッチ,switch,電気スイッチを入れてください。,Please turn on the light switch.
睡眠,すいみん,sleep,十分な睡眠をとることが重要です。,Getting enough sleep is important.
数,すう,"number, figure",数学の問題を解く。,Solving math problems.
数字,すうじ,"numeral, figure",数字を覚えるのが得意です。,I am good at memorizing numbers.
スープ,スープ,(Western) soup,昼食にスープを飲む。,Having soup for lunch.
末,すえ,"the end of, powder",道の末で待っています。,I will be waiting at the end of the road.
