Kanji,Reading,Meaning,Japanese Example,English Example
もしも,もしも,if,もしも希望が叶うなら、どんなことをしたいですか。,"If your wish could come true, what would you want to do?"
持ち上げる,もちあげる,"to raise, to lift up, to flatter",チームメイトは彼を称賛して持ち上げた。,The teammates praised and lifted him up.
用いる,もちいる,"to use, to make use of",最新のテクノロジーを幅広く用いている。,They are using a wide range of state-of-the-art technologies.
もったいない,もったいない,"wasteful; more than one deserves, unworthy of",食べ残しを捨てるのはもったいない。,It's wasteful to throw away leftovers.
尤も,もっとも,"quite right, plausible, natural",彼の提案は尤もであると認められた。,His proposal was recognized as quite right.
元,もと,"origin, original; former",元上司からの手紙を受け取った。,I received a letter from my former boss.
基,もと,basis,その発言は真実を基にしている。,His statement is based on truth.
素,もと,prime,彼の素直な性格が好感がもたれた。,His honest nature was well-liked.
戻す,もどす,"to restore, to put back, to return",本を読み終わったら図書館に戻してください。,Please return the book to the library after you finish reading it.
基づく,もとづく,"to be grounded on, to be based on",その法律は憲法に基づいて制定された。,The law was enacted based on the constitution.
求める,もとめる,"to request, to ask for; to seek, to search for",新しい知識を求めることは成長に欠かせない。,Seeking new knowledge is essential for growth.
者,もの,person (same as 人 (ひと)),彼は勤勉な者だ。,He is a diligent person.
物音,ものおと,sounds,夜に物音が聞こえる。,I can hear sounds at night.
物語,ものがたり,"tale, story, legend",昔々、素敵な物語があった。,"Once upon a time, there was a wonderful tale."
物事,ものごと,"things, everything",物事を理解する。,To understand everything.
燃やす,もやす,to burn,ゴミを燃やす。,To burn the trash.
模様,もよう,"pattern, figure, design",この布の模様が可愛い。,The pattern on this fabric is cute.
文句,もんく,a complaint,彼女はいつも文句を言う。,She always complains.
やがて,やがて,"before long, soon, at length",雨が止んで、やがて晴れるだろう。,"The rain will stop, and soon it will be sunny."
役,やく,"role, position",会議で重要な役を果たす。,Play an important role in the meeting.
約,やく,"approximately, about, some",約10分後に始まります。,It will start in about 10 minutes.
訳,やく,translation,その本を訳すのは難しい。,Translating that book is difficult.
訳す,やくす,to translate,この英語を日本語に訳してください。,Please translate this English into Japanese.
役割,やくわり,"assigning (allotment of) parts, role, duties",彼は会社で大切な役割を担っている。,He plays an important role in the company.
家賃,やちん,rent,アパートの家賃が高くなった。,The rent for the apartment has gone up.
厄介,やっかい,"trouble, burden, care",この問題は厄介だ。,This problem is troublesome.
宿,やど,"inn, lodging",旅館は宿を提供しています。,The inn provides lodging.
雇う,やとう,"to employ, to hire",新しい社員を雇う予定です。,We plan to hire new employees.
屋根,やね,roof,家の屋根が赤いです。,The roof of the house is red.
破る,やぶる,to tear; to violate; to defeat,契約を破る。,To break a contract.
破れる,やぶれる,"to get torn, to wear out",古いシャツが破れてしまった。,The old shirt got torn.
辞める,やめる,to retire,彼は会社を辞めました。,He quit the company.
やや,やや,"a little, partially, somewhat",その料理はやや辛いです。,That dish is somewhat spicy.
唯一,ゆいいつ,"only, sole, unique",彼は唯一の息子だ。,He is the only son.
勇気,ゆうき,"courage, bravery, boldness",彼女は勇気を持って挑戦しました。,She bravely took on the challenge.
友好,ゆうこう,friendship,国と国の友好関係を強化する。,To strengthen the friendship between countries.
有効,ゆうこう,"valid, effectual",この券は1年間有効です。,This ticket is valid for one year.
優秀,ゆうしゅう,"superiority, excellence",彼は優秀な学生です。,He is an excellent student.
優勝,ゆうしょう,"overall victory, championship",チームは全体優勝を果たした。,The team achieved an overall victory.
友情,ゆうじょう,"friendship, fellowship",二人の友情は深い。,The friendship between them is deep.
友人,ゆうじん,friend (formal),彼は私の親しい友人です。,He is my close friend.
有能,ゆうのう,"able, capable, efficient",彼女は非常に有能なリーダーだ。,She is a very capable leader.
郵便,ゆうびん,"mail, postal service",郵便で手紙を送ります。,I will send the letter by mail.
ユーモア,ユーモア,humor,彼のユーモアは誰もが楽しむ。,Everyone enjoys his humor.
有利,ゆうり,"advantageous, better",その提案は私たちにとって有利だ。,That proposal is advantageous for us.
床,ゆか,floor,床に座って本を読む。,To sit on the floor and read a book.
愉快,ゆかい,"pleasant, happy",愉快な人々と過ごす時間。,Time spent with cheerful people.
譲る,ゆずる,"to turn over, to assign, to hand over",彼は譲って仕事を引き受けた。,He handed over the work by yielding.
豊か,ゆたか,"abundant, wealthy, plentiful, rich",豊かな自然が広がっている。,Expansive rich nature spreads out.
茹でる,ゆでる,to boil,卵を茹でてください。,Please boil the eggs.
許す,ゆるす,"to permit, to allow, to approve",彼を許すことができますか？,Can you forgive him?
夜,よ,"evening, night",夜は静かです。,The night is quiet.
夜明け,よあけ,"dawn, daybreak",夜明けの空は美しい。,The dawn sky is beautiful.
酔う,よう,to get drunk,彼は飲みすぎて酔っ払った。,He got drunk from drinking too much.
容易,ようい,"easy, simple, plain",その問題は容易に解決できる。,That problem can be easily solved.
容器,ようき,"container, vessel",この容器に水を入れてください。,Please put water in this container.
陽気,ようき,"season, weather, cheerfulness",今日は陽気がいい。,The weather is cheerful today.
要求,ようきゅう,"request, demand",上司からの要求に応じる。,Meet the demands of the boss.
用心,ようじん,"care, precaution, caution",夜遅く帰るときは用心してね。,Be cautious when coming home late at night.
様子,ようす,"aspect, state, appearance",彼女の様子が心配だ。,I'm worried about her condition.
要するに,ようするに,"in a word, after all, in short …",要するに、そのアイデアはダメだ。,"In short, that idea won't work."
要素,ようそ,element,この問題の要素を理解する。,Understand the elements of this problem.
要点,ようてん,"gist, main point",レポートの要点を説明する。,Explain the main points of the report.
曜日,ようび,day of the week,曜日ごとに計画を立てる。,Plan for each day of the week.
ヨーロッパ,ヨーロッパ,Europe,ヨーロッパに行きたい。,I want to go to Europe.
予期,よき,"expectation, forecast",事件の予期を防ぐ。,Prevent the anticipation of the event.
横切る,よこぎる,"to cross (e.g., arms), to traverse",道を横切るときに注意して。,Be careful when crossing the road.
汚す,よごす,"to pollute, to make dirty",机を汚すな。,Don't dirty the desk.
予算,よさん,"estimate, budget",来年の予算を立てる。,Create a budget for next year.
止す,よす,"to cease, to give up",雨が止んだ。,The rain stopped.
寄せる,よせる,"to collect, to gather, to put aside",お金を貯めるために少しずつ寄せていく。,Save money little by little.
予測,よそく,"prediction, estimation",未来を予測するのは難しい。,Predicting the future is difficult.
ヨット,ヨット,yacht,ヨットで海を航海する。,Sail the sea on a yacht.
夜中,よなか,"midnight, dead of night",夜中に何か音がした。,There was a noise in the middle of the night.
世の中,よのなか,"society, the world",世の中は広い。,The world is vast.
余分,よぶん,"extra, excess, surplus",余分なお金を使うな。,Don't spend extra money.
予報,よほう,"forecast, prediction",天気予報を見る。,Check the weather forecast.
予防,よぼう,"prevention, protection against",予防接種を受ける。,Get vaccinated for prevention.
読み,よみ,reading,漢字の読み方が分からない。,I don't know how to read kanji.
嫁,よめ,"bride, daughter-in-law",彼女は素敵な嫁だ。,She is a wonderful daughter-in-law.
余裕,よゆう,excess; surplus,余裕がないとストレスが増える。,Stress increases without margin.
より,より,"twist, ply",この糸はよりをかける。,This thread is twisted.
因る,よる,to come from,その問題は貧困から因る。,The issue stems from poverty.
喜び,よろこび,"joy, pleasure, rejoicing",成功したときの喜びは最高だ。,The joy of success is the best.
よろしく (かん),よろしく (かん),"best regards, please remember me",よろしくお願いします。,"Best regards, please."
四,よん,four,四人でレストランに行った。,I went to the restaurant with four people.
来,らい～,next ~,来週から新しいプロジェクトが始まる。,A new project will start next week.
ライター,ライター,lighter; writer,彼はライターとして活躍している。,He is active as a writer.
楽,らく,"comfort, ease",休日は楽しい時間だ。,Holidays are enjoyable times.
ラケット,ラケット,racket,テニスのラケットを持っていく。,Bring the tennis racket.
利益,りえき,"profits, gains",企業の利益が増加した。,The company's profits increased.
理解,りかい,"understanding, comprehension",彼の説明を理解するのは難しい。,It is difficult to understand his explanation.
陸,りく,"land, shore",陸地を探検するのが好きです。,I like to explore the land.
利口,りこう,"clever, shrewd, bright",彼女は利口な解決策を見つけた。,She found a clever solution.
離婚,りこん,divorce,離婚することは決して簡単ではない。,Divorce is never easy.
理想,りそう,ideal,私の理想は世界平和です。,My ideal is world peace.
率,りつ,"rate, ratio, percentage",成功率が高い手術です。,It is a surgery with a high success rate.
留学,りゅうがく,studying abroad,彼女はフランスで留学しています。,She is studying abroad in France.
流行,りゅうこう,"fashionable, fad, prevailing",最近の流行はスニーカーです。,The latest trend is sneakers.
量,りょう,"quantity, amount",水の量を計りましょう。,Let's measure the amount of water.
寮,りょう,"hostel, dormitory",大学の寮に住んでいました。,I lived in the university dormitory.
両替,りょうがえ,"change, money exchange",外国通貨を両替する必要があります。,I need to exchange foreign currency.
料金,りょうきん,"fee, charge, fare",電車の料金を支払う。,Pay the train fare.
例,れい,"instance, example, case",この例を使って説明します。,I will explain using this example.
礼,れい,expression of gratitude; bow,礼を尽くすべきです。,One should show gratitude.
例外,れいがい,exception,厳しい規則には例外があります。,There are exceptions to strict rules.
礼儀,れいぎ,"manners, courtesy, etiquette",礼儀正しいふるまいが重要です。,Good manners are important.
冷静,れいせい,"calm, coolness",冷静な判断が求められる。,A calm judgment is required.
列,れつ,"queue, line, row",列に並ぶことは大変です。,It is hard to line up in a queue.
列車,れっしゃ,train (ordinary),列車の時刻表を調べる。,Check the train schedule.
レベル,レベル,level,日本語の能力レベルが上がった。,My Japanese proficiency level has improved.
連想,れんそう,"association (of ideas), suggestion",その言葉にはいい連想がある。,That word has a positive association.
連続,れんぞく,"consecutive, continuity, continuing",学習を連続させることが重要です。,It is important to continue learning.
老人,ろうじん,"the aged, old person",公園で老人たちが散歩している。,Elderly people are taking a walk in the park.
労働,ろうどう,"labor, work",労働者たちの権利を守る。,Protect the rights of workers.
ロケット,ロケット,"locket, rocket",ロケットが打ち上げられた。,The rocket was launched.
論じる,ろんじる,"to argue, to discuss",その問題について論じる必要がある。,There is a need to discuss the issue.
論争,ろんそう,"controversy, dispute",論争が続いている。,The controversy continues.
論文,ろんぶん,"thesis, paper",大学の論文を書く。,Write a thesis paper for university.
輪,わ,"ring, hoop, circle",輪になって手を繋いでください。,Please hold hands and form a circle.
ワイン,ワイン,wine,ワインのボトルを開ける。,Open a bottle of wine.
わがまま,わがまま,"selfishness, egoism, willfulness",わがままな態度を改めなければならない。,You must change your selfish attitude.
別れ,わかれ,"parting, separation, farewell",別れの言葉を交わす。,Exchange parting words.
分かれる,わかれる,"to branch off, to diverge from",2本の道がここで分かれている。,The two roads diverge here.
脇,わき,side,車の脇に駐車する。,Park the car on the side of the road.
湧く,わく,"to boil, to grow hot",泉から熱い水が湧いている。,Hot water is bubbling from the spring.
分ける,わける,"to divide, to separate",ジュースを等分に分けてください。,Please divide the juice equally.
わざと,わざと,on purpose,わざとらしく振る舞う。,Behave in an intentionally noticeable manner.
僅か,わずか,"only, merely, a little",僅かな変化が見られた。,A slight change was observed.
綿,わた,cotton,綿を使った服は涼しい。,Clothes made of cotton are cool.
話題,わだい,"topic, subject",日本語の話題を選んでください。,Please choose a topic in Japanese.
笑い,わらい,"laugh, laughter, smile",その映画は面白くて、笑いが絶えなかった。,"That movie was so funny, the laughter never stopped."
割る,わる,"to divide, to break",木を割って、薪を作る。,Splitting wood to make firewood.
悪口,わるくち,"abuse, insult",人を傷つけるような悪口を言ってはいけない。,You shouldn't say hurtful insults to people.
我々,われわれ,we,我々は一緒にこの問題を解決する。,We will solve this problem together.
湾,わん,"bay, gulf, inlet",その湾は美しい景色で知られている。,The bay is known for its beautiful scenery.
椀,わん,bowl,お椀にお味噌汁を注いでください。,Please pour miso soup into the bowl.
碗,わん,bowl,食卓にきれいな彩りのある碗を並べた。,I arranged beautifully colored bowls on the table.
悪,あく,"evil, vice",悪しき習慣を改めるべきだ。,Bad habits should be corrected.
当り,あたり,"hit, success, reaching the mark",当りくじで豪華な賞品を手に入れた。,I won a luxurious prize in a lottery.
アップ,アップ,up,スポーツ選手はパフォーマンスをアップさせるために練習を重ねる。,Athletes practice to improve their performance.
宛てる,あてる,"to address, to put",手紙を特定の住所宛てに送る。,To send a letter to a specific address.
アンケート,アンケート,"questionnaire (FRE: enquete), survey",最近、アンケート調査が行われた。,A questionnaire survey was recently conducted.
異,い,difference (of opinion),異なる意見があっても尊重すべきだ。,"Even if there are different opinions, they should be respected."
意,い,will,彼の意志は強固である。,His will is strong.
医院,いいん,"doctor's office (surgery), clinic",田舎に小さな医院がある。,There is a small clinic in the countryside.
怒り,いかり,anger,怒りを抑えることは重要だ。,It is important to control your anger.
粋,いき,"chic, style, purity",彼女のファッションセンスはとても粋だ。,Her sense of fashion is very chic.
意地,いじ,"disposition, spirit, obstinacy, appetite",意地を張るのは良くない。,It's not good to be stubborn.
依然,いぜん,"still, as yet",その問題は依然として解決されていない。,The problem has not been solved yet.
傷める,いためる,"to damage, to impair, to spoil",大切なものを傷めることは避けなければならない。,You must avoid damaging important things.
炒める,いためる,to stir-fry,野菜を炒めて美味しい炒め物を作った。,I made a delicious stir-fry by stir-frying vegetables.
一帯,いったい,"a region, the whole place",この一帯は静かで自然が豊かだ。,This area is quiet and abundant in nature.
異動,いどう,"a change, transfer",会社内で異動があった。,There was a transfer within the company.
衣料,いりょう,clothing,衣料品店で服を買った。,I bought clothes at a clothing store.
渦,うず,swirl,水面に大きな渦ができていた。,There was a big swirl on the water surface.
埋まる,うまる,"to be buried, to be filled",穴が埋まる前に種を植える。,Plant seeds before the hole is filled.
産む,うむ,"to give birth (v.t.), to deliver, to produce",彼女は健康な赤ちゃんを産んだ。,She gave birth to a healthy baby.
縁,えん,"chance, tie, relationship",運命の縁を信じる。,Believe in the fateful ties.
尾,お,"tail, ridge",猫の尾がふりふり動いていた。,The cat's tail was flicking back and forth.
負う,おう,"to bear, to owe",彼は多くの責任を負っている。,He bears a lot of responsibilities.
遅れ,おくれ,"delay, lag",列車が予定よりも遅れている。,The train is running late compared to the schedule.
教え,おしえ,"teachings, doctrine",古代の教えを大切に伝える。,Pass on the teachings of the ancients with care.
驚き,おどろき,"surprise, astonishment, wonder",彼の変化には驚きを隠せない。,I can't hide my surprise at his change.
織る,おる,to weave,手で布を織る技術を持っている。,Have the skill to weave cloth by hand.
欠く,かく,"to lack, to crack",プレゼン資料に情報が欠けている。,The presentation materials lack information.
角,かく,angle,四角形にラインを引く。,Draw lines in a square shape.
核,かく,"nucleus, kernel",原子核の研究が進んでいる。,Research on atomic nuclei is progressing.
格,かく,"status, character, case",社会的な格差をなくすために取り組む。,Work towards eliminating social class disparity.
学歴,がくれき,academic background,学歴だけが人の価値を決めるわけではない。,Educational background alone does not determine a person's value.
駆ける,かける,to run,野生の馬が原野を駆けていた。,The wild horse was running across the prairie.
賭ける,かける,"to bet, to risk, to gamble",彼は試合に賭けることを決めた。,He decided to bet on the game.
課題,かだい,"subject, theme, task",新しい課題に取り組む準備をしています。,I am preparing to tackle the new task.
片付け,かたづけ,"tidying up, finishing",部屋を片付ける時間がありません。,I don't have time to tidy up the room.
加味,かみ,"seasoning, flavoring",料理にお好みの調味料を加味してください。,Please season the dish with your favorite flavorings.
借り,かり,"borrowing, debt, loan",友達からお金を借りることを頼んだ。,I asked my friend to lend me some money.
狩り,かり,hunting,昔、一緒に狩りに出かけたことがある。,I used to go hunting with him in the past.
管,かん,"pipe, tube",この管は水を運ぶために使われます。,This pipe is used to transport water.
～観,かん,"feeling, view",彼女の観点から問題を考える。,Think about the problem from her point of view.
癌,がん,cancer,彼女の祖母は癌で亡くなった。,Her grandmother passed away from cancer.
刊行,かんこう,"publication, issue",新しい雑誌の刊行を始めた。,They started the publication of a new magazine.
慣行,かんこう,"customary practice, habit, traditional event",その地域での結婚式の慣行を知っていますか？,Do you know the customary practices of weddings in that area?
歓声,かんせい,"cheer, shout of joy",コンサートで歓声が沸き起こった。,Cheers erupted at the concert.
官僚,かんりょう,"bureaucrat, bureaucracy",彼は官僚制度の改革を提案した。,He proposed a reform of the bureaucracy.
器官,きかん,"organ (of body, instrument)",心臓は人間の重要な器官の1つです。,The heart is one of the vital organs in the human body.
季刊,きかん,"quarterly (e.g., magazine)",この雑誌は四半期ごとに季刊されています。,This magazine is published quarterly.
起源,きげん,"origin, beginning, rise",この伝統の起源は古代に遡る。,The origin of this tradition dates back to ancient times.
機構,きこう,"mechanism, organization",システム全体の機能と構造を理解する。,Understand the function and structure of the system as a whole.
築く,きずく,"to build, to establish",团結によって優れたコミュニティを築くことができる。,"Through unity, one can build a strong community."
規制,きせい,regulation,その業界の新たな規制が導入された。,New regulations in the industry have been introduced.
丘陵,きゅうりょう,hill,青い空に囲まれた美しい丘陵地帯。,Beautiful hilly landscape surrounded by blue sky.
協議,きょうぎ,"conference, discussion, negotiation",重要な問題について協議する必要があります。,We need to discuss important issues in the conference.
享受,きょうじゅ,"enjoyment, being given",彼はその特権を享受する資格がある。,He is entitled to enjoy that privilege.
協調,きょうちょう,"co-operation, conciliation, harmony",グループのメンバーと協調して作業します。,We will work together in harmony with the group members.
切り,きり,"limits, place to leave off",この話題についてはここで切りにしましょう。,Let's wrap up the discussion on this topic here.
菌,きん,"germ, bacterium",食品処理における細菌の役割を知る。,Learn about the role of bacteria in food processing.
近視,きんし,nearsightedness,彼は10歳のときから近視です。,He has been nearsighted since he was 10 years old.
苦,く,"trouble, worry, difficulty",困難な状況に直面しても、彼は苦も甘もなく笑っている。,"Even in difficult situations, he smiles without a hint of trouble or worry."
群,ぐん,group,群れで動く動物たちの行動を観察した。,Observed the behavior of animals moving in groups.
刑,けい,"penalty, sentence, punishment",彼は有罪判決を受け、刑を宣告された。,He was convicted and sentenced to punishment.
経緯,けいい,"sequence of events, course",その事件の経緯を明らかにする。,Clarify the sequence of events in that incident.
計器,けいき,"meter, gauge",この計器は正確な測定が可能です。,This gauge allows for precise measurements.
契機,けいき,"opportunity, chance",その出来事が私に転機をもたらした。,That event brought a turning point in my life.
携帯,けいたい,carrying something; mobile telephone,携帯電話を使用しながら運転することは危険です。,It is dangerous to use a mobile phone while driving.
形態,けいたい,"form, shape, figure",動植物の多様な形態を研究しています。,Studying the diverse forms of flora and fauna.
血管,けっかん,blood vessel,心臓から全身に血液を運ぶ血管。,Blood vessels that carry blood from the heart to the whole body.
決行,けっこう,"doing (with resolve), carrying out (e.g., a plan)",計画をしっかり立てたので、即座に決行しました。,We promptly carried out the plan since it was well-prepared.
件,けん,"matter, case, item",その問題についてさらに調査するべき事項があります。,There are further matters to investigate regarding that issue.
減少,げんしょう,"decrease, reduction, decline",需要の減少が利益に影響を与えている。,The decrease in demand is affecting the profits.
公演,こうえん,public performance,その有名な俳優の新しい舞台公演が好評です。,The new stage performance by that famous actor is well received.
後悔,こうかい,"regret, repentance",後悔する前に慎重に行動することが大切です。,It is important to act carefully before feeling regret.
航海,こうかい,"sail, voyage",新たな航海を始める準備が整った。,Preparations are complete to embark on a new voyage.
拘束,こうそく,"restriction, restraint",犯人を拘束するため、警察が動員された。,The police were mobilized to restrain the criminal.
