Kanji,Reading,Meaning,Japanese Example,English Example
ノー,ノー,no,ノーと言いたかった。,I wanted to say no.
軒,のき,eaves,雨が屋根の軒から垂れる。,Rain drips from the eaves.
残す,のこす,"to leave (behind, over), to save, to reserve",食事を残すのは良くない。,It's not good to leave food uneaten.
残り,のこり,"remaining, left-over",残り物を有効利用する。,Make good use of leftovers.
乗せる,のせる,"to place on (something), to take on board",車に友達を乗せる。,Give a friend a ride in the car.
載せる,のせる,to place on (something); to publish,写真を雑誌に載せる。,Publish a photo in a magazine.
覗く,のぞく,"to peek in, to look in",隣の部屋を覗いてみる。,Peek into the next room.
除く,のぞく,"to remove, to exclude, to except",他の人々を除いて、すべての学生が宿題を提出しました。,All students submitted their homework except for the others.
望み,のぞみ,"wish, desire, (a) hope",彼女の望みは世界平和です。,Her wish is world peace.
望む,のぞむ,"to desire, to wish for; to view",成功を望むためには努力が必要です。,Effort is necessary to wish for success.
後,のち,"afterwards, since then",会議後、懇親会が開かれました。,"After the meeting, a social gathering was held."
ノック,ノック,knock; fungo (baseball),ドアをノックしてから入室してください。,Please knock on the door before entering.
伸ばす,のばす,"to extend, to stretch, to reach out",彼は手を伸ばしてリンゴを取った。,He reached out his hand and took the apple.
延ばす,のばす,"to extend, to stretch, to reach out",締め切りを延ばすことはできません。,We cannot extend the deadline.
伸びる,のびる,"to extend, to make progress, to grow",植物は毎日成長して伸びている。,The plants are growing and extending every day.
延びる,のびる,to be prolonged,会議が長引いて予定が延びた。,The meeting ran long and the schedule was delayed.
述べる,のべる,"to state, to express, to mention",自分の意見をはっきりと述べることが大切です。,It is important to clearly state your opinion.
上る,のぼる,"to ascend, to go up, to climb",階段を上って2階へ行きます。,I will go up the stairs to the second floor.
昇る,のぼる,"to arise, to ascend, to go up",太陽が東の空に昇る。,The sun rises in the eastern sky.
載る,のる,"to appear (in print), to be recorded",その記事は新聞に載りました。,That article appeared in the newspaper.
のんびり,のんびり,"carefree, at leisure",休日はのんびり過ごしたいです。,I want to spend my holidays relaxing.
場,ば,"place, field (physics)",会議室は広い場所です。,The conference room is a spacious place.
はあ (かん),はあ (かん),(sigh),疲れた時ははあと一息ついてください。,Please take a deep breath when you're tired.
パーセント,パーセント,percent,この問題の解答率は90パーセントです。,The answer rate for this problem is 90 percent.
灰,はい,ash,火事で家が全焼して、灰になった。,The house burned down in a fire and turned to ash.
梅雨,ばいう,rainy season,梅雨時は雨が多いです。,There is a lot of rain during the rainy season.
バイオリン,バイオリン,violin,彼女はとても上手にバイオリンを弾きます。,She plays the violin very skillfully.
ハイキング,ハイキング,hiking,週末に山にハイキングに行く予定です。,I plan to go hiking in the mountains on the weekend.
配達,はいたつ,"delivery, distribution",荷物の配達が速い宅配会社を選んだ。,I chose a fast delivery courier company for my packages.
パイプ,パイプ,pipe; channels official or otherwise,水道管はパイプでつながっている。,The water pipes are connected by pipes.
俳優,はいゆう,"actor, actress, performer",彼女は有名な俳優です。,She is a famous actress.
パイロット,パイロット,pilot,飛行機のパイロットは熟練しています。,The airplane pilot is experienced.
生える,はえる,"to grow, to spring up; to cut (teeth)",庭に新しい花が生えてきました。,New flowers have sprung up in the garden.
墓,はか,"grave, tomb",祖父母の墓をお参りに行きました。,I visited my grandparents' tomb.
馬鹿,ばか,"fool, idiot",失敗は馬鹿ではありません、学びの一つです。,"Failure is not foolishness, it is a part of learning."
博士,はかせ,"doctorate, PhD., doctor",彼は物理学の博士号を取得しました。,He obtained a Doctorate in Physics.
計る,はかる,"to measure, to weigh, to survey",体重を計るためには体重計が必要です。,A scale is necessary to measure weight.
量る,はかる,"to measure, to weigh, to survey",材料の量り方を間違えないように注意してください。,Please be careful not to make a mistake in measuring the ingredients.
測る,はかる,"to measure, to weigh, to survey",地図を使って距離を測りました。,We measured the distance using a map.
掃く,はく,"to sweep, to brush, to gather up",床を掃いてから拭いてください。,Please sweep the floor before mopping.
吐く,はく,"to throw up, to vomit",彼は病気で吐いてしまいました。,He vomited due to illness.
拍手,はくしゅ,"clapping hands, applause",演奏が終わるとたくさんの拍手が送られた。,There was a lot of applause when the performance ended.
莫大,ばくだい,"enormous, vast",プロジェクトには莫大な予算が必要です。,The project requires a vast budget.
爆発,ばくはつ,"explosion, detonation, eruption",突然、爆発音が聞こえた。,"Suddenly, a loud explosion was heard."
博物館,はくぶつかん,museum,町には歴史博物館があります。,The town has a history museum.
激しい,はげしい,"violent, vehement, intense",激しい嵐が海岸線を襲いました。,A violent storm hit the coastline.
はさみ,はさみ,scissors,はさみを使って、紙を切ってください。,Please use scissors to cut the paper.
破産,はさん,(personal) bankruptcy,彼の会社は破産した。,His company went bankrupt.
端,はし,"end (e.g., of street), edge, margin",道路の端に犬が座っていた。,A dog was sitting at the edge of the road.
始まり,はじまり,"origin, beginning",新たな始まりを迎える。,To welcome a new beginning.
パス,パス,"path, pass (in games)",迷路で正しいパスを見つける。,Find the right path in the maze.
外す,はずす,"to unfasten, to remove",襟を外してリラックスする。,Relax by unbuttoning the collar.
パスポート,パスポート,passport,旅行のためにパスポートを更新する。,Renew your passport for the trip.
外れる,はずれる,"to be disconnected, to be out (e.g., of gear)",時計の歯車が外れた。,The gear of the clock came off.
旗,はた,flag,学校の前に国旗が掲げられていた。,The national flag was raised in front of the school.
肌,はだ,skin,肌が乾燥してかゆい。,My skin is dry and itchy.
裸,はだか,"naked, nude",海で裸で泳いだ。,I swam naked in the sea.
畑,はたけ,"field, patch",庭に畑を作る。,To cultivate a field in the garden.
働き,はたらき,"work, labor",一生懸命働くことは大切だ。,Working hard is important.
バッグ,バッグ,bag,新しいバッグを買いたい。,I want to buy a new bag.
発見,はっけん,"discovery, detection, finding",未知の生物を発見した。,Discovered an unknown species.
発行,はっこう,issue (publications),雑誌の発行が毎月ある。,The magazine is issued every month.
発車,はっしゃ,departure of a vehicle,新幹線の発車が遅れた。,The departure of the bullet train was delayed.
発射,はっしゃ,"firing, shooting, discharge",火薬を使って砲弾を発射する。,Fire the shell using gunpowder.
罰する,ばっする,"to punish, to penalize",子供たちを罰する必要がある。,Children need to be punished.
発達,はったつ,"development, growth",科学技術の発達が目覚ましい。,The remarkable progress of science and technology.
ばったり,ばったり,(to meet) by chance,友達と道でばったり会った。,Met a friend by chance on the street.
発展,はってん,"development, growth, progress",街は急速に発展している。,The city is developing rapidly.
発表,はっぴょう,announcement; publication; presentation,成果を発表する日がやってきた。,The day has come to announce the results.
発明,はつめい,invention,新しい発明が特許を取った。,The new invention was patented.
派手,はで,"showy, flashy, gaudy",彼女のドレスはとても派手だ。,Her dress is very flashy.
話し合う,はなしあう,"to discuss, to talk together",問題を話し合って解決する。,Discuss and solve the problem.
離す,はなす,"to part, to separate",手を離さないでください。,Please don't let go of my hand.
放す,はなす,"to separate, to set free",風船を放して空に飛ばす。,Release the balloon and let it fly in the sky.
離れる,はなれる,"(something, someone) separates; parts from; to be apart",友達と離れて異国で生活する。,Live in a foreign country apart from friends.
放れる,はなれる,"to leave, to get free, to cut oneself off",手錠を割ると手から放れた。,"When the handcuffs broke, they slipped from the hand."
羽,はね,wing,鳥の羽が美しい。,The bird's wings are beautiful.
羽根,はね,feather,天使の羽根は白く柔らかい。,An angel's feathers are white and soft.
幅,はば,"width, breadth",幅広い選択肢がある。,There is a wide range of choices.
母親,ははおや,mother,母親の愛情は深い。,A mother's love is deep.
省く,はぶく,"to omit, to eliminate",文章から不要な言葉を省く。,Omit unnecessary words from the text.
場面,ばめん,"scene, setting (e.g., of novel)",小説の場面が映像化された。,The scene from the novel was adapted into a movie.
流行る,はやる,"to be popular, to come into fashion",若者に人気の映画が流行る。,The movie popular among young people is trending.
腹,はら,"abdomen, belly, stomach",腹が減ったと思ったらお腹が鳴った。,"Just as I thought I was hungry, my stomach growled."
原,はら,"field, plain",広大な原野が広がっていた。,A vast expanse of wilderness spread out.
バランス,バランス,balance,生活のバランスを保つことが重要。,Maintaining a balance in life is important.
針,はり,"needle, hand (e.g., clock)",時計の針が止まった。,The clock's hand stopped.
範囲,はんい,"extent, scope, range",このクラスの範囲を超えてはいけません。,You must not exceed the scope of this class.
反抗,はんこう,"opposition, resistance",彼女は権威に反抗するタイプだ。,She is the type to resist authority.
犯罪,はんざい,crime,犯罪を犯した人々は逮捕されました。,The criminals have been apprehended.
ハンサム,ハンサム,handsome,彼はとてもハンサムな男性です。,He is a very handsome man.
反省,はんせい,"reflection, reconsideration, regret",彼は自分の行動を反省している。,He is reflecting on his own actions.
判断,はんだん,"judgment, decision",正しい判断をすることが重要です。,Making the right decision is important.
犯人,はんにん,"offender, criminal",事件の犯人はまだ逮捕されていません。,The criminal in the case has not been caught yet.
販売,はんばい,"sale, selling, marketing",商品の販売が好調です。,Sales of the product are going well.
灯,ひ,light,部屋に灯を灯しました。,Turned on the light in the room.
ビール,ビール,beer,居酒屋でビールを飲むのが好きです。,I like drinking beer at izakaya.
被害,ひがい,damage,被害を受けた人々を助ける必要があります。,We need to help the victims.
比較,ひかく,comparison,この2つを比較してみましょう。,Let's compare these two.
ピクニック,ピクニック,picnic,週末に友達とピクニックに行きました。,I went on a picnic with friends on the weekend.
悲劇,ひげき,tragedy,その物語は悲劇的な結末を迎えた。,The story had a tragic ending.
飛行,ひこう,"aviation, flight",飛行機の飛行が遅れています。,The flight of the airplane is delayed.
膝,ひざ,"knee, lap",膝に氷を当ててください。,Please apply ice to the knee.
非常,ひじょう,"emergency, extraordinary, unusual",非常時には落ち着いて行動しましょう。,"In case of emergency, stay calm and act."
美人,びじん,beautiful person (woman),彼女は本当に美人ですね。,She is truly a beautiful woman.
額,ひたい,"forehead, brow",彼女の額にキスをしました。,I kissed her on the forehead.
日付,ひづけ,"date, dating",今日の日付を記入してください。,Please fill in today's date.
引越し,ひっこし,"moving, changing residence",引越しの準備が進んでいます。,Preparations for moving are progressing.
必死,ひっし,"desperation, frantic, inevitable result",必死に彼を探しましたが見つからなかった。,"I searched desperately for him, but couldn't find him."
ぴったり,ぴったり,"exactly, neatly, sharp",その服はとてもぴったりしている。,That outfit fits perfectly.
引っ張る,ひっぱる,"to pull, to stretch, to drag",そのロープを引っ張ってください。,Please pull that rope.
否定,ひてい,"negation, denial",その主張を否定することができません。,I cannot deny that claim.
ビデオ,ビデオ,video tape; VCR,映画をビデオに録画した。,I recorded the movie on video.
一言,ひとこと,one word,彼から一言も言葉をもらえなかった。,I didn't get a word from him.
人込み,ひとごみ,crowd of people,混んでいる駅の人込みに困っていた。,I was troubled by the crowded station.
等しい,ひとしい,equal,二つの数は等しいです。,The two numbers are equal.
独り,ひとり,"alone, unmarried",彼女は一人で旅行に行くことが好きです。,She likes to travel alone.
一人一人,ひとりひとり,"one by one, each",一人一人にプレゼントを渡しました。,I gave a present to each person.
批判,ひはん,criticism,その意見に対する批判が多い。,There are many criticisms of that opinion.
批評,ひひょう,"criticism, review, commentary",新作映画についての批評が出始めた。,Critiques of the new movie have begun to appear.
秘密,ひみつ,"secret, secrecy",彼女は私に秘密を教えてくれた。,She told me a secret.
微妙,びみょう,"delicate, subtle",その選択は微妙なバランスが必要だ。,That choice requires a subtle balance.
紐,ひも,"string, cord",靴紐が解けています。,The shoelace is untied.
冷やす,ひやす,"to cool, to refrigerate",飲み物を冷やしすぎないでください。,Please don't chill the drink too much.
費用,ひよう,"cost, expense",このプロジェクトの予算はどのくらいの費用がかかりますか？,How much will the budget for this project be?
表,ひょう,"table (e.g., Tab 1), chart, list",表を見て答えなさい。,Look at the table and answer.
秒,びょう,second (60th min),競技の結果を時間の秒単位で記録しました。,The results of the competition were recorded in seconds.
評価,ひょうか,"assessment, evaluation",この商品の評価が高いです。,This product has received high evaluations.
表現,ひょうげん,"expression, presentation",彼の表現力は素晴らしいです。,His expression skills are excellent.
表情,ひょうじょう,facial expression,彼女の表情から感情を読み取れる。,You can read her emotions from her facial expressions.
平等,びょうどう,"equality, impartiality, evenness",すべての人が平等であるべきだ。,Everyone should be treated equally.
評判,ひょうばん,"fame, reputation",そのレストランは評判がいいらしい。,It seems that restaurant has a good reputation.
表面,ひょうめん,"surface, outside, face",その物の表面をきれいに拭いた。,I wiped the surface of that object clean.
広がる,ひろがる,"to spread (out), to extend, to stretch, to reach to, to get around",花火が夜空に広がった。,The fireworks spread across the night sky.
広げる,ひろげる,"to spread, to extend, to expand, to enlarge",地図を広げて道を調べた。,I spread out the map to examine the route.
広める,ひろめる,"to broaden, to propagate",新しいビジネスを広めるために努力する。,I am making efforts to expand the new business.
品,ひん,"goods; taste, elegance",高品質の製品を提供しています。,We offer high-quality products.
瓶,びん,bottle,ワイン瓶を開けるのにコルク抜きが必要です。,You need a corkscrew to open a wine bottle.
便,びん,"way, means; flight",今度の便は満員です。,The next flight is fully booked.
ピン,ピン,pin,画びょうを留めるのにピンが必要です。,You need a pin to secure the picture.
不,ふ,"un(~), non(~), negative prefix",不可能なことは存在しない。,There is nothing that is impossible.
不,ぶ,"un(~), non(~), negative prefix",不可能なことは存在しない。,There is nothing that is impossible.
無,ぶ,"nothing, naught, nil, zero",無駄な努力はしないでほしい。,I don't want you to make futile efforts.
分,ぶ,"dividing, part",チョコレートを分け合いながら楽しんだ。,We enjoyed sharing chocolate together.
不安,ふあん,"anxiety, uneasiness",未来について不安を感じる。,I feel anxious about the future.
風景,ふうけい,scenery,美しい風景を見ることができた。,I was able to see a beautiful scenery.
夫婦,ふうふ,"married couple, husband and wife",幸せな夫婦生活を送りたい。,I want to lead a happy married life.
笛,ふえ,"flute, whistle",公園で笛を吹く音が聞こえた。,I heard the sound of a flute being played in the park.
不可,ふか,"wrong, bad, impossible",None,None
深まる,ふかまる,to deepen,None,None
武器,ぶき,"weapon, arms",None,None
拭く,ふく,"to wipe, to dry",None,None
服装,ふくそう,"clothes, attire",冬の服装は暖かくする必要がある。,You need to dress warmly in winter.
含む,ふくむ,"to contain, to include",この料理にはたくさんの野菜が含まれています。,This dish contains a lot of vegetables.
含める,ふくめる,to include,プレゼントにメッセージを含めた。,I included a message with the present.
袋,ふくろ,"bag, sack",買い物袋を持ってショッピングに出かけた。,I went shopping with a shopping bag.
不幸,ふこう,"unhappiness, sorrow, misfortune",彼の不幸を知って心配した。,I worried upon learning about his misfortune.
節,ふし,"tune, tone, knob",歌唱力の節が感じられる。,I feel the tune of the singing.
無事,ぶじ,"safety, peace",家族が無事であることが一番の幸せだ。,The safety of my family is the greatest happiness.
不思議,ふしぎ,"mystery, curiosity",その事件は不思議なことだらけだ。,That incident is full of mysteries.
不自由,ふじゆう,"discomfort, disability, inconvenience",足が不自由な人には手伝ってあげてください。,Please help those with mobility difficulties.
夫人,ふじん,"wife, Mrs, madam",大統領夫人が来日されます。,The First Lady is visiting Japan.
婦人,ふじん,woman (same as 女性 (じょせい)、女の人 (おんなのひと)),この会は婦人のためのものです。,This meeting is for women.
不正,ふせい,"injustice, unfairness",その選手は不正をしていたと発覚した。,It was revealed that the athlete had cheated.
防ぐ,ふせぐ,"to defend (against), to protect, to prevent",インフルエンザを予防するためにマスクを着用する。,Wear a mask to prevent the flu.
不足,ふそく,"insufficiency, shortage",水が不足しているエリアがある。,There are areas where water is scarce.
舞台,ぶたい,stage (theater),彼女は毎晩舞台に立っている。,She performs on stage every night.
双子,ふたご,"twins, a twin",双子の姉妹はとても仲が良い。,The twin sisters get along very well.
再び,ふたたび,"again, once more, a second time",再び会えて嬉しいです。,I'm glad to see you again.
普段,ふだん,"in everyday situations, usually, ordinarily",普段は家で勉強をします。,I usually study at home.
縁,ふち,"edge, rim",カップの縁が壊れてしまった。,The rim of the cup broke.
打つ,ぶつ,"to hit, to strike",野球の試合でホームランを打った。,He hit a home run in the baseball game.
不通,ふつう,"blockade, interruption, stoppage",交通が不通になった。,The traffic was blocked.
物価,ぶっか,(commodity/consumer) prices,最近、物価が上がっている。,Prices have been rising recently.
ぶつかる,ぶつかる,"to strike, to collide with",車と衝突して彼は怪我をした。,He collided with a car and got injured.
ぶつける,ぶつける,"to knock, to strike hard, to hit and attack",怒って机を叩きつけた。,He angrily hit the desk.
物質,ぶっしつ,"material, substance",この物質はとても重要です。,This substance is very important.
物理,ぶつり,physics,彼は大学で物理学を専攻している。,He is majoring in physics at university.
筆,ふで,writing brush,習字のために新しい筆を買った。,I bought a new writing brush for calligraphy.
ふと,ふと,"suddenly, accidentally, incidentally",ふと彼女のことを思い出した。,"Suddenly, I remembered her."
部分,ぶぶん,"portion, section, part",この問題の一部分が難しいです。,A part of this problem is difficult.
不平,ふへい,"complaint, discontent, dissatisfaction",不平を言うのではなく、行動しましょう。,"Instead of complaining, let's take action."
不満,ふまん,"dissatisfaction, discontent, complaints",サービスの質に不満を感じた。,I was dissatisfied with the quality of service.
増やす,ふやす,"to increase (v.t.), to add to",スキルを増やすために勉強しています。,I am studying to increase my skills.
殖やす,ふやす,"to increase, to add to",植物を増やす方法を学んだ。,I learned how to propagate plants.
プラス,プラス,plus,プラスの要素とマイナスの要素があります。,There are positive and negative elements.
プラスチック,プラスチック,plastic,この容器はプラスチックでできています。,This container is made of plastic.
プラン,プラン,plan,旅行のプランを立てる。,Make a plan for the trip.
不利,ふり,"disadvantage, drawback",彼にはこの試合が不利だ。,He is at a disadvantage in this match.
振る,ふる,"to wave, to shake; to sprinkle; to cast (actor)",手を振って友達を見送った。,I waved my hand to say goodbye to my friend.
震える,ふるえる,"to shiver, to shake, to quake",寒さで全身が震えた。,I shivered all over from the cold.
ブレーキ,ブレーキ,a brake,急いでブレーキを踏んだ。,I pressed the brake suddenly.
触れる,ふれる,"to touch, to feel, to violate",彼女の手に触れた瞬間、感情が伝わった。,"The moment I touched her hand, I felt her emotions."
プロ,プロ,professional,彼はプロの野球選手です。,He is a professional baseball player.
分,ぶん,"dividing, part, segment",時間を平等に3つに分けました。,I divided the time equally into three parts.
文,ぶん,sentence,その文章の文法が正しいか確認してください。,Please check if the grammar of the sentence is correct.
雰囲気,ふんいき,"atmosphere (e.g., musical), mood, ambiance",部屋には和やかな雰囲気が漂っていた。,There was a peaceful atmosphere in the room.
分析,ぶんせき,analysis,データの分析を行いました。,We conducted an analysis of the data.
文明,ぶんめい,civilization,古代文明の遺跡を訪れた。,I visited the ruins of an ancient civilization.
分野,ぶんや,"field, sphere",彼は医学の分野に専門家です。,He is an expert in the field of medicine.
塀,へい,"wall, fence",庭に木製の塀が取り付けられている。,A wooden fence is installed in the garden.
平均,へいきん,"equilibrium, balance, average",テストの平均点が高かった。,The average score on the test was high.
平和,へいわ,peace,世界には平和が必要です。,Peace is needed in the world.
別に,べつに,"(not) particularly, nothing",別に予定はありません。,I don't have any particular plans.
減らす,へらす,"to decrease, to diminish",体重を減らすためにダイエットをしています。,I am dieting to lose weight.
減る,へる,"to decrease (in size or number), to diminish",商品の値段は減っています。,The price of the product is decreasing.
ベルト,ベルト,Belt for western clothes,ズボンにベルトを締める。,Fasten the belt on the pants.
変化,へんか,"change, variation, shift",彼の考え方が変化した。,His way of thinking has changed.
ペンキ,ペンキ,paint,家の壁をペンキで塗りました。,I painted the walls of the house.
変更,へんこう,"change, modification, alteration",予定が変更されました。,The schedule has been changed.
