Kanji,Reading,Meaning,Japanese Example,English Example
引用,いんよう,"quotation, citation",学術論文を書く時には信頼できる引用源を探す必要がある。,"When writing academic papers, it is necessary to find reliable sources for citations."
ウイスキー,ウイスキー,whiskey,彼はウイスキーを片手に歌を歌っていた。,He was singing with a whiskey in hand.
上,うわ,"upper, outer, surface",その建物の上には美しい庭が広がっていた。,A beautiful garden spread out on top of the building.
魚,うお,fish,川でたくさんの魚を見ることができた。,I was able to see a lot of fish in the river.
うがい,うがい,gargling,風邪をひかないようにうがいをしましょう。,Let's gargle to avoid catching a cold.
受け取る,うけとる,"to receive, to get, to accept",プレゼントを受け取った時の喜びは特別だ。,The joy of receiving a gift is special.
動かす,うごかす,"to move, to shift",机を動かすのに手伝ってもらえますか？,Can you help me move the desk?
兎,うさぎ,"rabbit, hare",森の中でうさぎが飛び跳ねている。,A rabbit is hopping around in the forest.
牛,うし,"cattle, cow",牛たちが牧草を食べている。,The cows are eating grass.
失う,うしなう,"to lose, to part with",大切なものを失うのは辛いことだ。,Losing something important is a painful experience.
疑う,うたがう,"to doubt, to distrust",彼の言葉を疑ってはいけない。,Do not doubt his words.
宇宙,うちゅう,"universe, cosmos, space",宇宙の深淵について考える。,Contemplate the depths of the universe.
討つ,うつ,"to attack, to avenge",敵を討つために戦う。,Fight to defeat the enemy.
撃つ,うつ,"to attack, to shoot",的を撃つために練習する。,Practice shooting at the target.
うっかり,うっかり,carelessly; inadvertently,うっかりコップを落としてしまった。,Carelessly dropped the cup.
映す,うつす,"to project, to reflect, to cast (shadow)",スクリーンに映す映画は感動的だった。,The movie projected on the screen was touching.
訴える,うったえる,"to complain, to appeal, to sue (a person)",違法行為を裁判所に訴える。,Take illegal actions to court.
写る,うつる,"to be photographed, to be projected",写る写真が美しい。,The photographed picture is beautiful.
映る,うつる,"to be reflected, to come out (photo)",湖面に月が映っていた。,The moon was reflected on the lake.
うなる,うなる,"to groan, to moan",痛みでうなっていた。,Moaned in pain.
奪う,うばう,"to rob, to deprive",犯人にお金を奪われた。,The criminal stole the money.
馬,うま,horse; promoted bishop (in Japanese chess known as shogi),馬を飼うのは大変だ。,Keeping a horse is hard work.
生まれ,うまれ,"birth, birth-place",私の生まれは東京です。,I was born in Tokyo.
有無,うむ,"yes or no, presence or absence",同意があるかどうかを確認してください。,Please check for consent.
梅,うめ,"plum, lowest (of a three-tier ranking system)",春に梅の花が咲く。,Plum blossoms bloom in spring.
埋める,うめる,"to bury, to fill up, to fill (a seat, a vacant position)",穴を埋めるために土を使う。,Use soil to fill the hole.
裏切る,うらぎる,"to betray, to turn traitor",友人を裏切ることは許されない。,Betraying a friend is unforgivable.
羨ましい,うらやましい,"envious, enviable",彼女の才能には羨ましさを覚える。,I envy her talent.
売れる,うれる,to be sold,新しい商品が良く売れている。,The new product is selling well.
噂,うわさ,"rumor, gossip",噂が事実かどうかはわからない。,It's unclear whether the rumor is true.
運,うん,"fortune, luck",幸運は準備とチャンスの出会いだ。,Luck is the meeting of preparation and opportunity.
運転,うんてん,"operation, driving",運転席から道路を見る。,Look at the road from the driver's seat.
柄,え,"handle (of a sword, dagger, etc.), grip",刀の柄は黒くて美しい。,The handle of the sword is black and beautiful.
永遠,えいえん,"eternity, perpetuity, immortality",愛は永遠だと信じている。,I believe love is eternal.
永久,えいきゅう,"eternity, perpetuity, immortality",永久的な平和を望む。,Hope for eternal peace.
影響,えいきょう,"influence, effect",友達の意見に影響される。,Influenced by a friend's opinion.
営業,えいぎょう,"business, trade, management",新製品の営業を始める。,Start sales of a new product.
衛星,えいせい,satellite,宇宙衛星から地球を観察する。,Observe Earth from a satellite.
栄養,えいよう,"nutrition, nourishment",バランスの取れた栄養バランスの食事を摂る。,Eat a well-balanced nutritious meal.
笑顔,えがお,smile (on one's face),彼女の笑顔が眩しい。,Her smile is dazzling.
描く,えがく,"to draw, to depict, to describe",絵を描くのが好きだ。,I enjoy drawing pictures.
餌,えさ,"feed, bait",釣り餌を用意する。,Prepare bait for fishing.
エネルギー,エネルギー,energy (GER: energie),エネルギーの消費を減らす。,Reduce energy consumption.
得る,える,"to get, to gain, to win, to learn",経験から多くの知識を得ることができる。,One can gain a lot of knowledge from experience.
得る,うる,"to get, to gain, to win",経験から多くの知識を得ることができる。,One can gain a lot of knowledge from experience.
円,えん,"circle, yen",円形のテーブルを買いました。,Bought a round table.
延期,えんき,"postponement, adjournment",会議が明日に延期された。,The meeting was postponed until tomorrow.
演技,えんぎ,"acting, performance",彼女は素晴らしい演技を見せた。,She gave a fantastic performance.
援助,えんじょ,"assistance, aid, support",困っている人に援助するのは大切だ。,It is important to assist those in need.
エンジン,エンジン,engine,車のエンジンが調子悪い。,The car engine is not working well.
演説,えんぜつ,"speech, address",政治家の演説を聞いていると眠くなる。,I get sleepy listening to politicians' speeches.
演奏,えんそう,musical performance,彼はピアノの演奏がうまい。,He is good at playing the piano.
老い,おい,"old age, the aged",彼は年をとってからも元気だ。,He is energetic even in old age.
追い付く,おいつく,"to overtake, to catch up (with)",友達のスピードに追いつくのが大変だ。,It's hard to catch up with my friend's speed.
王,おう,king,中世には王様が国を統治していた。,Kings ruled countries in the Middle Ages.
追う,おう,"to chase, to run after",その犬が猫を追っている。,The dog is chasing the cat.
応援,おうえん,"aid, assistance, help",試合でチームを応援する。,To cheer for the team during the match.
王様,おうさま,king,ベッドの上で王様が眠っている。,The king is sleeping on the bed.
王子,おうじ,prince,おとぎ話には王子が出てくることが多い。,Princes often appear in fairy tales.
応じる,おうじる,"to adapt, to respond, to comply with",要求に応じることは重要だ。,It is important to respond to requests.
横断,おうだん,crossing,大通りを横断するときは注意が必要だ。,"When crossing the main street, caution is necessary."
終える,おえる,to finish,仕事を終えてから帰る。,Finish work before going home.
大いに,おおいに,"much, considerably (same as 大変 (たいへん)), greatly",彼女は大いに喜んでいた。,She was greatly pleased.
覆う,おおう,"to cover, to hide, to conceal",テーブルクロスでテーブルを覆う。,Cover the table with a tablecloth.
大家,おおや,landlord,アパートの大家に家賃を払う。,Pay the rent to the apartment landlord.
丘,おか,"hill, height",丘の上に夕日が沈む。,The sun sets behind the hill.
沖,おき,open sea,船は沖を目指して進んでいた。,The ship was heading towards the open sea.
奥,おく,"interior, inner part",森の奥で小さな家を見つけた。,Found a small house deep in the forest.
贈る,おくる,"to present, to give to, to award to",友達に誕生日プレゼントを贈った。,Gave a birthday present to a friend.
起こる,おこる,"to occur, to happen",事故が起こって道路が渋滞している。,"An accident has occurred, causing a traffic jam."
押える,おさえる,"to stop, to restrain, to press down",怒りを抑えることが大切だ。,It is important to control one's anger.
幼い,おさない,"very young, childish",彼の幼い頃の思い出を聞いた。,He talked about his childhood memories.
収める,おさめる,"to store to pay, to supply",収入を節約に収める。,Save income for savings.
納める,おさめる,"to store to pay, to supply",税金を納める期限が迫っている。,The deadline for paying taxes is approaching.
治める,おさめる,"to govern, to manage; to subdue",彼は部下を上手に治めている。,He manages his subordinates well.
お辞儀,おじぎ,bow,会議でお辞儀をするのが日本の礼儀だ。,Bowing in a meeting is Japanese etiquette.
お洒落,おしゃれ,"smartly dressed, fashion-conscious",彼女はいつもお洒落をしている。,She is always dressed stylishly.
お喋り,おしゃべり,"chattering, talk",友達とお喋りするのが楽しい。,It is fun to chat with friends.
汚染,おせん,"pollution, contamination",環境が汚染されている。,The environment is polluted.
恐らく,おそらく,perhaps,恐らく明日雨が降るだろう。,It will probably rain tomorrow.
恐れる,おそれる,"to fear, to be afraid of",彼は暗闇を恐れている。,He is afraid of the dark.
恐ろしい,おそろしい,"terrible, dreadful",彼は恐ろしい夢を見た。,He had a terrible dream.
教わる,おそわる,to be taught,新しい技術を教わった。,Learned a new technique.
お互い,おたがい,"mutual, reciprocal, each other",お互いが理解し合える関係が理想的だ。,An ideal relationship where both parties can understand each other.
穏やか,おだやか,"calm, gentle, quiet",公園で穏やかな午後を過ごした。,Spent a calm afternoon in the park.
男の人,おとこのひと,man,道で男の人に道を尋ねた。,Asked a man for directions on the road.
大人しい,おとなしい,"obedient, docile, quiet",犬が大人しい性格だ。,The dog has a quiet personality.
劣る,おとる,"to fall behind, to be inferior to",その選手は他の選手に劣っている。,That player is inferior to the other players.
鬼,おに,"ogre, demon, 'it' (e.g.,in a game of tag)",お化け屋敷で鬼ごっこをする。,Playing tag with demons in the haunted house.
帯,おび,"band, sash",浴衣に帯を締める。,Tying a sash around the yukata.
お昼,おひる,"lunch, noon",毎日お昼にカフェでランチを食べる。,I have lunch at a cafe every day.
オフィス,オフィス,office,彼女は毎日オフィスで働いている。,She works at the office every day.
溺れる,おぼれる,"to be drowned, to indulge in",泳ぐのが苦手なので、水に溺れるのが怖い。,"I'm not good at swimming, so I'm afraid of drowning."
お前,おまえ,"you (sing), presence (of a high personage)",お前が好きだ。,I like you.
おめでとう,おめでとう,"Congratulations!, an auspicious occasion!",おめでとうございます！合格です。,Congratulations! You passed.
お目に掛かる,おめにかかる,"meet ~, see ~",お目に掛かることを楽しみにしています。,I'm looking forward to meeting you.
思い付く,おもいつく,"to think of, to hit upon",解決策が思い付かない。,I can't think of a solution.
思い出,おもいで,"memories, recollections, reminiscence",昔の思い出を振り返る。,Looking back on old memories.
主に,おもに,"mainly, primarily",このショップは主に若者をターゲットにしている。,This shop mainly targets young people.
思わず,おもわず,"unintentional, spontaneous",その景色に思わず息をのむ。,I couldn't help but gasp at the scenery.
泳ぎ,およぎ,swimming,プールで泳ぎを楽しむ。,Enjoy swimming in the pool.
およそ,およそ,"about, roughly, approximately",道までおよそ５分かかる。,It takes about 5 minutes to walk to the street.
及ぼす,およぼす,"to exert, to cause, to exercise",成功に対してポジティブな影響を及ぼす。,Have a positive impact on success.
下す,おろす,"to lower, to let go down",窓から目を下してお辞儀する。,Lower your eyes from the window and bow.
降ろす,おろす,"to take down, to launch, to drop",荷物を車から降ろす。,Unload the luggage from the car.
卸す,おろす,"to sell wholesale, grated (vegetables)",野菜を卸している市場に行く。,Go to the market that sells wholesale vegetables.
音,おん,"sound, note",音楽を聞くのが好きだ。,I like listening to music.
恩,おん,"favor, obligation, debt of gratitude",彼には多くの恩がある。,He owes a lot to him.
温暖,おんだん,warmth,温暖な気候が好きだ。,I like warm climates.
温度,おんど,temperature,体温を温度計で測る。,Measure body temperature with a thermometer.
可,か,passable,その提案は受け入れ可能です。,The proposal is acceptable.
蚊,か,mosquito,夏には蚊にさされる。,Get bitten by mosquitoes in the summer.
課,か,"department, division",日本語の課に参加する。,Participate in the Japanese language class.
カー,カー,car,高速道路をカーで走る。,Drive on the highway by car.
カード,カード,"card, curd",クレジットカードを使って支払う。,Pay with a credit card.
貝,かい,"shell, shellfish",貝を集めて海岸を歩く。,Collect shells and walk along the coast.
害,がい,"harm, damage",環境への害を最小限に抑える。,Minimize harm to the environment.
会員,かいいん,"member, the membership",新しい会員を募集する。,Recruit new members.
絵画,かいが,"picture, painting",美術館で有名な絵画を見る。,See famous paintings at the art museum.
海外,かいがい,"foreign, abroad, overseas",海外旅行に行くのは夢だ。,Going abroad is a dream.
会計,かいけい,"account, finance",経理の会計士は数字に強い。,The accountant in accounting is good with numbers.
解決,かいけつ,"settlement, solution, resolution",問題の解決に取り組む。,Work on solving the problem.
会合,かいごう,"meeting, assembly",重要な会合があるため、欠席できません。,I can't miss this important meeting.
外交,がいこう,diplomacy,外交政策を研究する。,Study foreign diplomacy.
開始,かいし,"start, commencement, beginning",プロジェクトの開始日が近づいている。,The start date of the project is approaching.
解釈,かいしゃく,"explanation, interpretation",彼の言葉の解釈について意見を述べる。,Express opinions on the interpretation of his words.
外出,がいしゅつ,"outing, going out",週末に友達と外出する。,Go out with friends on the weekend.
改善,かいぜん,"betterment, improvement",このプロジェクトを改善するための提案を考えています。,I am thinking of proposals to improve this project.
快適,かいてき,"pleasant, agreeable",このホテルの客室は快適でした。,The hotel room was comfortable.
回復,かいふく,"recovery (from illness), rehabilitation, restoration",手術後、回復が早かった。,The recovery was quick after the surgery.
飼う,かう,to keep; to own (a pet); to raise; to feed,友達がかわいい犬を飼っています。,My friend has a cute dog.
帰す,かえす,to send back,間違った商品を帰すことができますか？,Can I return the wrong item?
代える,かえる,"to exchange, to interchange, to substitute",彼の意見は私の考え方を代えさせた。,His opinion made me change my way of thinking.
替える,かえる,"to exchange, to interchange, to substitute",この服はサイズが合わないので、替えたいです。,"This clothes doesn't fit me, so I want to change it."
換える,かえる,"to exchange, to interchange, to substitute",お金を換えるために銀行に行きました。,I went to the bank to exchange money.
反る,かえる,"to warp, to be warped, to curve",木材は湿気で反ることがあります。,Wood can warp due to humidity.
香り,かおり,"aroma, fragrance",朝の庭に漂う花の香りが好きです。,I like the scent of flowers wafting in the morning garden.
画家,がか,painter,彼女は有名な画家です。,She is a famous painter.
抱える,かかえる,to hold or carry under or in the arms,大きな荷物を抱えていたので、助けてあげました。,I helped him because he was carrying a big bag.
価格,かかく,"price, value",この商品の価格は高すぎます。,The price of this product is too high.
化学,かがく,chemistry,高校で化学を勉強しています。,I am studying chemistry in high school.
輝く,かがやく,"to shine, to glitter, to sparkle",星が夜空に輝いていた。,The stars were shining in the night sky.
係,かかり,person in charge,この会社の営業部門の係長をしています。,I am the head of the sales department of this company.
罹る,かかる,to suffer from,風邪に罹ったので、病院に行きます。,"I caught a cold, so I will go to the hospital."
限る,かぎる,"to restrict, to limit, to confine",時間を守るためには制限を設けるべきです。,"To keep time, there should be limits."
掻く,かく,to scratch,猫が頭を掻いている。,The cat is scratching its head.
描く,かく,"to draw, to depict, to describe",絵を描くのが好きです。,I like drawing pictures.
嗅ぐ,かぐ,"to sniff, to smell",新鮮なパンの香りが漂ってきた。,The scent of fresh bread wafted over.
家具,かぐ,furniture,新しい家具を買いたいです。,I want to buy new furniture.
学,がく,"learning, knowledge",学ぶことは楽しいです。,Learning is enjoyable.
額,がく,amount; frame,この絵の額が高価そうです。,The frame of this picture seems expensive.
覚悟,かくご,"resolution, resignation, readiness",厳しい状況にも負けず覚悟を決める。,Decide on your resolve without losing in tough situations.
確実,かくじつ,"certainty, reliability, soundness",演技の成功は確実だった。,The success of the performance was certain.
学者,がくしゃ,scholar,私の祖父は有名な学者でした。,My grandfather was a famous scholar.
学習,がくしゅう,"study, learning",新しい言語の学習を始めました。,I started learning a new language.
隠す,かくす,"to hide, to conceal",秘密を隠すのは難しいことです。,It's difficult to hide a secret.
拡大,かくだい,"magnification, enlargement",プレゼンテーションのために図を拡大しました。,I enlarged the picture for the presentation.
確認,かくにん,"affirmation, confirmation",情報の正確性を確認しました。,I confirmed the accuracy of the information.
学問,がくもん,"scholarship, study, learning",学問の専門家として尊敬されています。,He is respected as an expert in scholarship.
隠れる,かくれる,"to hide, to be hidden",木の陰に隠れて涼んだ。,I hid in the shade of the tree and cooled off.
影,かげ,"shade, shadow, other side",月明かりの影が廊下に広がっていた。,The moonlight shadow spread across the hallway.
陰,かげ,"shade, shadow, other side",日陰の方が涼しい。,The shade is cooler.
欠ける,かける,to be lacking,満月は欠けていなかった。,The full moon was not lacking.
加減,かげん,adjustment; addition and subtraction,スパイスの加減を調整しました。,I adjusted the amount of spices.
過去,かこ,past,過去の過ちから学ぶべきだ。,We should learn from past mistakes.
籠,かご,"basket, cage",籠に小鳥が入っていました。,There was a small bird in the cage.
囲む,かこむ,"to surround, to encircle",友達に囲まれて楽しい時間を過ごした。,I had a good time surrounded by friends.
火災,かさい,"conflagration, fire",火災が発生しました。,A conflagration has occurred.
重なる,かさなる,"to be piled up, lie on top of one another",色々な問題が重なっています。,Various issues are piling up.
重ねる,かさねる,"to pile up, to put something on another, to heap up",重ねてお礼を言いました。,I expressed my thanks repeatedly.
飾り,かざり,decoration,クリスマスツリーに飾りをつける。,Decorate the Christmas tree with ornaments.
貸し,かし,"loan, lending",友達に本を貸しました。,I lent a book to my friend.
菓子,かし,"confectionery, sweet",お土産に和菓子を買いました。,I bought Japanese sweets as souvenirs.
家事,かじ,household matters; housework (same as 家の仕事 (いえのしごと)),家事を手伝う。,Help with household chores.
賢い,かしこい,"wise, clever, smart",彼は賢い判断をする。,He makes wise decisions.
歌手,かしゅ,singer,彼女は有名な歌手です。,She is a famous singer.
数,かず,"number, figure, amount",数学の勉強をする。,Study mathematics.
稼ぐ,かせぐ,"to earn income, to labor",彼は一生懸命働いてお金を稼ぐ。,He works hard to earn money.
数える,かぞえる,to count,リンゴを数える。,Count the apples.
型,かた,"mold, model, style",新しい型の携帯電話を買った。,I bought a new model of mobile phone.
肩,かた,shoulder,肩が凝っています。,My shoulders are stiff.
堅い,かたい,"hard, firm, solid",このパンは堅くて食べにくい。,This bread is hard and difficult to eat.
硬い,かたい,"hard, firm, solid",硬貨を見つけました。,I found a hard coin.
方々,かたがた,persons,多くの方々が参加しました。,Many people participated.
片付く,かたづく,"to put in order, to solve",部屋を片付ける。,Tidy up the room.
刀,かたな,"sword, saber",侍は刀を持っています。,The samurai carries a sword.
語る,かたる,"to talk, to tell, to recite",昔話を語る。,Tell an old story.
勝ち,かち,"win, victory",試合に勝ちました。,Won the game.
価値,かち,"value, worth, merit",その絵には高い価値がある。,That painting has great value.
がっかり,がっかり,"feel disappointed, be dejected, lose heart",試験に落ちてがっかりした。,I was disappointed to fail the exam.
活気,かっき,vigor; liveliness; vitality; energy,市場は活気に満ちている。,The market is filled with vitality.
楽器,がっき,musical instrument,楽器を演奏する。,Play a musical instrument.
学期,がっき,term (school),新しい学期が始まりました。,A new school term has begun.
活動,かつどう,"action, activity",サークルで活動する。,Participate in club activities.
活躍,かつやく,activity,スポーツ選手が活躍している。,The athlete is performing actively.
活用,かつよう,conjugation; practical use,この表現を活用してください。,Please utilize this expression.
仮定,かてい,"assumption, supposition, hypothesis",仮定に基づいて論じる。,Argue based on assumptions.
過程,かてい,process,プロジェクトの過程を考える。,Consider the process of the project.
課程,かてい,"course, curriculum",講座を通して課程を理解する。,Understand the curriculum through the course.
悲しむ,かなしむ,"to be sad, to mourn for, to regret",友達の死を悲しんだ。,Mourned the death of a friend.
必ずしも,かならずしも,"(not) always, (not) necessarily",必ずしも成功とは限らない。,Success is not always guaranteed.
かなり,かなり,"considerably, fairly, quite",かなり深い考えを持っている。,I have quite deep thoughts.
金,かね,"gold, metal; money",お金を貯める。,Save money.
鐘,かね,"bell, chime",教会の鐘が鳴る。,The church bell is ringing.
可能,かのう,"possible, practicable, feasible",その計画は可能ですか？,Is that plan feasible?
株,かぶ,stock; stump (of tree),株を売買する。,Trade stocks.
被る,かぶる,to wear; to be covered with,雨に被れないように傘を持って行きましょう。,Let's take an umbrella so we don't get rained on.
我慢,がまん,"patience, endurance, perseverance",彼は過酷な状況にもかかわらず、我慢強く挑戦し続けた。,He persevered through harsh conditions and continued to challenge himself.
上,かみ,first volume; superior quality; governmental,彼女はその上司に対して尊敬の念を抱いている。,She deeply respects her superior.
神,かみ,god,神々は人々の信仰の対象として崇拝されている。,Gods are worshipped as objects of faith by people.
雷,かみなり,thunder,雷の音が空に響いた。,The sound of thunder echoed in the sky.
髪の毛,かみのけ,hair (head),彼女は美しい金髪の毛を持っている。,She has beautiful golden hair.
科目,かもく,"(school) subject, curriculum, course",新しい学校で好きな科目を選ぶことができる。,You can choose your favorite subjects at the new school.
かもしれない,かもしれない,"maybe, perhaps",来週雨が降るかもしれない。,It may rain next week.
